{
  "$schema": "http://json-schema.org/draft-07/schema#",
  "title": "ZAP Receipt (v0.1)",
  "type": "object",
  "additionalProperties": false,
  "required": [
    "zap",
    "type",
    "id",
    "ts",
    "missionId",
    "verdict",
    "exit",
    "chainDigest",
    "stepsExecuted",
    "stepsTotal",
    "checks",
    "at"
  ],
  "properties": {
    "zap": {
      "type": "string",
      "enum": [
        "0.1"
      ],
      "description": "ZAP protocol version (0.1 = the v0 slice of issue #809)"
    },
    "type": {
      "type": "string",
      "enum": [
        "receipt"
      ]
    },
    "id": {
      "type": "string",
      "minLength": 1,
      "description": "Unique message id (host: UUID v4)"
    },
    "ts": {
      "type": "string",
      "pattern": "^\\d{4}-\\d{2}-\\d{2}T\\d{2}:\\d{2}:\\d{2}(\\.\\d+)?Z$",
      "description": "ISO-8601 UTC with Z suffix"
    },
    "missionId": {
      "type": "string",
      "minLength": 1
    },
    "verdict": {
      "type": "string",
      "enum": [
        "pass",
        "fail"
      ]
    },
    "exit": {
      "type": "integer",
      "enum": [
        0,
        1
      ],
      "description": "The receipt's exit (0 = pass, 1 = fail)"
    },
    "chainDigest": {
      "type": "string",
      "pattern": "^[a-f0-9]{64}$",
      "description": "Head of the evidence chain — the client recomputes and compares (receipt verification)"
    },
    "stepsExecuted": {
      "type": "integer",
      "minimum": 0,
      "description": "Session-cumulative executed steps"
    },
    "stepsTotal": {
      "type": "integer",
      "minimum": 0,
      "description": "Session-cumulative accepted steps"
    },
    "checks": {
      "type": "array",
      "minItems": 1,
      "items": {
        "type": "object",
        "additionalProperties": false,
        "required": [
          "name",
          "ok"
        ],
        "properties": {
          "name": {
            "type": "string",
            "minLength": 1
          },
          "ok": {
            "type": "boolean"
          },
          "detail": {
            "type": "string"
          }
        }
      }
    },
    "at": {
      "type": "string",
      "pattern": "^\\d{4}-\\d{2}-\\d{2}T\\d{2}:\\d{2}:\\d{2}(\\.\\d+)?Z$"
    }
  }
}
